{
  "schema": "formation-registry",
  "owner_id": "formations.force.civil.rice",
  "owner_type": "formation_registry",
  "authority": true,
  "force_ref": "force.civil.rice",
  "formations": [
    {
      "id": "formation.land.rice.palace.guard",
      "name": "Land of Rice Fields Daimyo Guard, First Palace Element",
      "force_ref": "force.civil.rice",
      "role": "ready_not_engaged",
      "lifecycle_origin": "standing",
      "personnel_total": 25,
      "authorized_personnel": 25,
      "doctrine_ref": "doc.civil.field",
      "training_ref": "train.civil.field",
      "cohesion": 71,
      "morale": 72,
      "readiness": 82,
      "location_ref": "place.rice.capital",
      "activity_summary": "standing_readiness",
      "command_slot": {
        "representation": "cold_command_slot",
        "profile_ref": "command_profile.shinobi_tactical_standard"
      },
      "command_personnel": {
        "representation": "conserved_command_personnel",
        "count": 2,
        "includes_commander_slot": true,
        "groups": [
          {
            "count": 2,
            "rank_distribution": {
              "guard": 2
            },
            "condition": {
              "healthy": 1,
              "light_healing_injury": 1
            }
          }
        ]
      },
      "components": [
        {
          "id": "component.land.rice.palace.guard.assault",
          "troop_type": "guards",
          "role": "assault",
          "count": 16,
          "rank_distribution": {
            "commander": 1,
            "guard": 11,
            "senior_guard": 3,
            "support": 1
          },
          "condition": {
            "healthy": 15,
            "light_healing_injury": 1
          },
          "tendency_profile_ref": "formation.tendency.05"
        },
        {
          "id": "component.land.rice.palace.guard.ranged_control",
          "troop_type": "archers",
          "role": "ranged_control",
          "count": 3,
          "rank_distribution": {
            "guard": 3
          },
          "condition": {
            "healthy": 3
          },
          "tendency_profile_ref": "formation.tendency.01"
        },
        {
          "id": "component.land.rice.palace.guard.recon",
          "troop_type": "scouts",
          "role": "recon",
          "count": 2,
          "rank_distribution": {
            "guard": 2
          },
          "condition": {
            "healthy": 2
          },
          "tendency_profile_ref": "formation.tendency.04"
        },
        {
          "id": "component.land.rice.palace.guard.support",
          "troop_type": "logistics_support",
          "role": "support",
          "count": 2,
          "rank_distribution": {
            "guard": 2
          },
          "condition": {
            "healthy": 2
          },
          "tendency_profile_ref": "formation.tendency.03"
        }
      ],
      "operational_objective": {
        "kind": "delay",
        "target_refs": [],
        "lethal_authorized": false
      }
    }
  ]
}
